{
  "schema_version": "vectorized-model-input-v1",
  "vectorizer_id": "signed-sha256-feature-hash-v1",
  "dimension": 256,
  "state": [
    {
      "index": 5,
      "value": -3.0
    },
    {
      "index": 26,
      "value": 1.0
    },
    {
      "index": 27,
      "value": 2.0
    },
    {
      "index": 37,
      "value": 2.0
    },
    {
      "index": 39,
      "value": 3.0
    },
    {
      "index": 47,
      "value": 1.0
    },
    {
      "index": 64,
      "value": -1.0
    },
    {
      "index": 69,
      "value": -1.0
    },
    {
      "index": 82,
      "value": 1.0
    },
    {
      "index": 91,
      "value": -1.0
    },
    {
      "index": 93,
      "value": -1.0
    },
    {
      "index": 105,
      "value": -1.0
    },
    {
      "index": 113,
      "value": 1.0
    },
    {
      "index": 129,
      "value": -2.0
    },
    {
      "index": 133,
      "value": 1.0
    },
    {
      "index": 140,
      "value": 2.0
    },
    {
      "index": 152,
      "value": 1.0
    },
    {
      "index": 153,
      "value": 1.0
    },
    {
      "index": 167,
      "value": 2.0
    },
    {
      "index": 176,
      "value": -2.0
    },
    {
      "index": 197,
      "value": 3.0
    },
    {
      "index": 198,
      "value": 1.0
    },
    {
      "index": 202,
      "value": -1.0
    },
    {
      "index": 204,
      "value": -3.0
    },
    {
      "index": 210,
      "value": 1.0
    },
    {
      "index": 226,
      "value": 1.0
    },
    {
      "index": 239,
      "value": 2.0
    },
    {
      "index": 241,
      "value": 1.0
    },
    {
      "index": 248,
      "value": -1.0
    }
  ],
  "candidates": [
    [
      {
        "index": 133,
        "value": -1.0
      },
      {
        "index": 187,
        "value": -1.0
      },
      {
        "index": 222,
        "value": -1.0
      }
    ],
    [
      {
        "index": 149,
        "value": -1.0
      },
      {
        "index": 187,
        "value": -1.0
      },
      {
        "index": 222,
        "value": -1.0
      }
    ],
    [
      {
        "index": 126,
        "value": 1.0
      },
      {
        "index": 187,
        "value": -1.0
      },
      {
        "index": 222,
        "value": -1.0
      }
    ],
    [
      {
        "index": 26,
        "value": -1.0
      },
      {
        "index": 99,
        "value": -1.0
      },
      {
        "index": 138,
        "value": -1.0
      }
    ],
    [
      {
        "index": 26,
        "value": -1.0
      },
      {
        "index": 103,
        "value": 1.0
      },
      {
        "index": 138,
        "value": -1.0
      }
    ],
    [
      {
        "index": 161,
        "value": -1.0
      },
      {
        "index": 197,
        "value": -1.0
      }
    ],
    [
      {
        "index": 98,
        "value": 1.0
      },
      {
        "index": 161,
        "value": -1.0
      },
      {
        "index": 197,
        "value": -1.0
      }
    ],
    [
      {
        "index": 42,
        "value": -1.0
      }
    ]
  ],
  "action_mask": [
    true,
    true,
    true,
    true,
    true,
    true,
    true,
    true
  ],
  "source_action_ids": [
    "play_card:4c39f94d03690264",
    "play_card:7a3f9f1fd9ef4131",
    "play_card:440e5c1fdd314f1f",
    "use_potion:a229e2659f2cde72",
    "use_potion:d90161ad942114cf",
    "discard_potion:6201982120852026",
    "discard_potion:428c55ba86a4e03e",
    "end_turn:44136fa355b3678a"
  ]
}
